{
  "$schema": "https://json-schema.org/draft/2020-12/schema",
  "$id": "https://decision-assurance.example/schemas/dats-scenario-v0.1.json",
  "title": "DATS Scenario",
  "type": "object",
  "required": ["id", "title", "objective", "input", "expected"],
  "properties": {
    "id": {"type": "string", "pattern": "^DATS-[0-9]{3}$"},
    "title": {"type": "string", "minLength": 5},
    "objective": {"type": "string", "minLength": 10},
    "input": {
      "type": "object",
      "required": ["claim", "evidence", "constraints", "policies", "actors", "risk"],
      "properties": {
        "claim": {"type": "string"},
        "evidence": {"type": "array", "items": {"type": "object"}},
        "constraints": {"type": "array", "items": {"type": "object"}},
        "policies": {"type": "array", "items": {"type": "object"}},
        "actors": {"type": "object"},
        "risk": {"type": "object"}
      },
      "additionalProperties": true
    },
    "expected": {
      "type": "object",
      "required": ["outcome", "reason_codes", "human_review"],
      "properties": {
        "outcome": {"enum": ["PASS", "REVIEW", "BLOCK"]},
        "reason_codes": {"type": "array", "minItems": 1, "items": {"type": "string"}},
        "human_review": {"type": "boolean"}
      },
      "additionalProperties": false
    }
  },
  "additionalProperties": false
}
